Summary,Score
"Published: 2:42am, 28 Oct 2024 The United Nations Security Council will meet on Monday to discuss Israel's attack on Iran, council president Switzerland said on Sunday. The Swiss UN mission said the meeting had been requested by Iran with the support of Algeria, China and Russia. The number of people killed in the attack has reportedly risen to five. Iranian media on Sunday unanimously reported the death of a civilian in the strikes, citing an organisation that works with casualties of war. He was reportedly in a suburb southwest of the capital Tehran at the time of the attack. 03:45 Iran launches missile attack on Israel, Netanyahu vows retribution Iran launches missile attack on Israel, Netanyahu vows retribution According to officials, four soldiers were killed in the Israeli attack, and several military sites, such as radar installations, were damaged.",
"A memo circulating among at least half a dozen advisers to former President Donald J. Trump recommends that if he is elected, he bypass traditional background checks by law enforcement officials and immediately grant security clearances to a large number of his appointees after being sworn in, according to three people briefed on the matter. The proposal is being promoted by a small group including Boris Epshteyn, a top legal adviser to Mr. Trump who was influential in its development, according to the three people. It is not clear whether Mr. Trump has seen the proposal or whether he is inclined to adopt it if he takes office. But it would allow him to quickly install loyalists in major positions without subjecting them to the risk of long-running and intrusive F.B.I. background checks, potentially increasing the risks of people with problematic histories or ties to other nations being given influential White House roles. Such checks hung up clearances for a number of aides during Mr. Trump's presidency, including Mr. Trump's son-in-law Jared Kushner and Mr. Epshteyn himself. The proposal suggests using private-sector investigators and researchers to perform background checks on Mr. Trump's intended appointees during the transition, cutting out the role Asked about the proposal, Steven Cheung, a spokesman for the Trump campaign, responded with an attack on Vice President Kamala Harris, saying she and Democrats 'have weaponized the Department of Justice to attack President Trump and his supporters' and that Mr. Trump would use 'the full powers of the presidency' to build his administration starting on Inauguration Day. A number of Mr. Trump's advisers — and the former president himself — have long viewed background checks for security clearances with deep suspicion. They believe that the process is designed to make challenges to outcomes difficult, and that personal pieces of information submitted during the vetting can be disseminated later for damaging results. Mr. Trump has long railed about the F.B.I. being part of a 'deep state' conspiracy to undermine him. It is not clear what positions the altered system would cover, but the people familiar with the proposal said it appeared to apply to a large number of potential Trump appointees in a second administration. Mr. Epshteyn, who was It is not clear whether Mr. Epshteyn would like to go into government, but his name is on at least one list compiled outside the official transition process as a possible White House counsel, or a top lawyer overseeing them, according to two people briefed on the matter. That list was prepared with Mr. Epshteyn's input, according to a third person briefed on the matter. Traditional federal background investigations for security clearances carry risks for potential appointees. Lying on official application materials could lead to Security clearances have been a critical part of the government's system for protecting national security secrets, which dates back to World War II and the early Cold War. Background investigations for clearances are intended to turn up hidden foreign conflicts or personal problems that could reveal that applicants are a security risk because they could be susceptible to blackmail by foreign spies or are otherwise untrustworthy. The process is grounded in executive orders and memorandums — not federal statutes enacted by Congress — and Under Many agencies investigate their own nominees, and sometimes basic vetting, including for employees of contractors, has been outsourced to private firms which then provide dossiers to the sponsoring agencies. But under Starting with information provided by applicants in their clearance application forms, agents check law enforcement databases and interview people who know them in search of red flags. They look at any criminal conduct; psychological conditions and personal behavior; alcohol or substance abuse; foreign contacts; personal finances and similar matters. If initial checks uncover no problems, people can be granted interim clearances to begin working with classified information while the investigation continues, though they can face greater restrictions on access to more sensitive data — especially more restricted forms of top secret information — until they receive permanent clearances. Across the government, the findings of background checks are shared with the sponsoring agency, which makes the final decision. And when a background check uncovers evidence of a potential crime, it can lead to a criminal referral for further investigation. But presidents subjecting their appointees to the FB.I. vetting process is a norm, not a legal requirement. As a matter of constitutional law, there is nothing to stop a president from cutting out the F.B.I. and granting a clearance to access classified information to anyone, based on his or her own discretion. Like many other aspects of Mr. Trump's first term and plans for a second term, the proposed move to do so for his appointees would exploit the gap between legal limits and traditional norms of presidential self-restraint. A number of Mr. Trump's appointees faced delays and roadblocks in getting clearances in his administration. In addition to Mr. Epshteyn, who failed to get a clearance during a brief White House stint in 2017 before leaving the post, many aides worked with temporary security clearances for more than a year because they could not get permanent clearances approved. Others eventually left the government, too. (The Trump campaign said earlier this year that Mr. Epshteyn's clearance issue, which was never clarified, was 'resolved,' but provided no further details). Mr. Kushner, who played a variety of roles including as an envoy to the Middle East brokering deals to get Arab states to recognize Israel, went through months of questions over his background check for reasons that were never publicly disclosed. Finally, in 2018, Mr. Trump overrode the normal process and In 2019, a manager in the White House's Personnel Security Office told a House committee Mr. Kushner's allies have claimed that the process was an attempt to damage Mr. Trump by extension. There are other aides who have been investigated along with Mr. Trump over the past four years who might struggle under the current process if Mr. Trump wants to bring them into the government. Among them are Walt Nauta, Mr. Trump's personal aide, who was his co-defendant in the since-dismissed classified documents case, and Peter Navarro, who was Mr. Trump's trade adviser and Another former White House adviser who is close to Mr. Trump, Stephen K. Bannon, is set to be released from prison in the coming days. He was Mr. Kushner has said he does not plan to return to government. But if he changes his mind, the career officials handling security clearances inside the U.S. intelligence community under the current system would have to contend with the implications of the nearly $3 billion he raised for Other supporters of Mr. Trump have proposed overhauling the system for vetting security clearances. One came from the Project 2025 ' The project proposed that the White House's National Security Council — run by the president's national security adviser — should be authorized to adjudicate internally whether its own staff receive security clearances, with investigators who 'work directly for the N.S.C. and whose sole task is to clear N.S.C. officials.' (The Trump campaign has disavowed Project 2025, and a top Trump transition official said that its authors would not be involved in any transition.) In December, the Center for Renewing America, a pro-Trump think tank run by Mr. Trump's former head of the Office of Management and Budget, Russ Vought, published a The paper said that it must be made 'crystal clear that agency heads may grant, suspend or revoke security clearances — notwithstanding the recommendations of subordinates.' The post",
"At the start of Sunday's State Memorial Ceremony for the Fallen of Operation Iron Swords at Mount Herzl, the public knew of 898 soldiers, police officers, and members of the security services who had fallen since October 7. By the end of the ceremony, that number stood at 902, as the names of four more soldiers who fell—this time in a battle in southern Lebanon on Saturday—were permitted for publication while the ceremony was underway. Later in the day, two more names were added. This chilling convergence of events was an embodiment of the kind of year Israel has experienced: during a memorial service, more names were added to those being mourned. To a certain extent, the period since October 7 has felt like one long Remembrance Day. The names of the fallen are read on the radio, heart-wrenching stories fill television and radio broadcasts, and newspapers feature interviews with friends and families recounting snippets of the fallen's lives. Over a year later, this extended Remembrance Day-like feeling shows no sign of letting up. The two state memorial ceremonies held on Sunday as part of the government-declared national day of mourning for the events of October 7 —one for fallen soldiers, police, and security service personnel, and the other for civilians killed—gave the day a Remembrance Day feel. But the entire year since October 7 has carried that heavy and sorrowful tone. Or, as President Isaac Herzog said at the beginning of his speech at the ceremony for the soldiers: 'It has already been a full year that our lives have been shrouded in unceasing and heavy mourning for our sons and daughters who fell in battle.' Even before uttering those words, he said, 'At this moment, our hearts are with the dozens wounded and affected in the severe terror attack near the Glilot base.' This is Israel, October 2024: More fallen soldiers, a memorial ceremony, a terror attack. Headlines never stop breaking in Israel As the ceremony was broadcast on Channel 12, the news ticker at the bottom of the screen read: 'A ramming attack in Glilot: 37 wounded, 6 in serious condition, the truck driver neutralized.' But this is also Israel, October 2024: One hundred and forty IAF aircraft flying nearly 2,000 kilometers in jaw-dropping precision over enemy territory to knock out some of the world's best air defense systems, the Russian-made S-300s, and a factory making key components for Iran's ballistic missiles. Also, IDF soldiers blowing up a massive underground tunnel—in fact, an underground military base for Hezbollah that was to serve as a jumping-off point for terrorists to invade northern Israel in an October 7-style attack—using enough explosives to make the earth shake and trigger earthquake sensors. The country is at war, and the national mood swings from euphoria—the killing of Hamas leader Yahya Sinwar, the attacks in Iran, the discovery and destruction of the Hezbollah tunnels—to depression: hearing about additional fatalities, or another terrorist attack. 'A year ago,' Prime Minister Benjamin Netanyahu said at the state ceremony, 'we suffered an unbearable blow, but we were not broken. Immense pain struck us, but we did not collapse. We fought back against our attackers, as we have done that until today.' That pretty much sums up the mood: pain, but resilience and determination. It is horrifyingly difficult—as the two memorial ceremonies interspersed with news of another terror attack and more fallen soldiers made so clear on Sunday—but if the Jewish people want a state here, history has provided no alternative path. Netanyahu quoted words a senior Egoz commander gave his unit before they moved into southern Lebanon earlier this month: 'We have a great privilege to write history. As we did in Gaza, we'll do so here in the north.' Indeed, history is being written. Decades from now, people will read about this war—the sacrifices and the achievements—and admire the grit, determination, and will of those who fought it, and the civilians who endured it, with the same admiration we today have for those who fought in and survived the War of Independence, the Six-Day War, and the Yom Kippur War. Their admiration will be well deserved. However, the emotional rollercoaster of the last two two months -- beginning with the exploding beepers in Lebanon and running through the killing of Hezbollah head Hassan Nasrallah, Sinwar, Iranian ballistic missile attacks, drone attacks on a Golani base, and the unceasing reports of fallen soldiers and terror attacks — has been a heavy burden for all. Adding to the difficulty are the personal war-related worries so many people face, alongside the general national concerns. These include anxieties about the well-being of loved ones in the army and reserves in Gaza and in southern Lebanon, as well as concerns about how their spouses and children are managing at home without them. This combination makes the entire experience far from easy. Necessary? Yes. Meaningful? Yes. The stuff of which Jewish history is made? Definitely. But trying, taxing and—as was so clearly evident on Sunday—profoundly difficult.",
"Iran's Supreme Leader Ali Khamenei has given a measured response to Israeli strikes on the country, saying the attack should not be 'exaggerated or downplayed' while refraining from pledging immediate retaliation. President Masoud Pezeshkian said Iran would 'give an appropriate response' to the attack, which killed at least four soldiers, adding that Tehran did not seek war. Israel said it targeted military sites in several regions of Iran on Saturday in retaliation for Iranian attacks, including a barrage of almost 200 ballistic missiles fired towards Israel on 1 October. On Sunday Prime Minister Benjamin Netanyahu said Israel had crippled Iranian air defence and missile production systems. He said the strikes had 'severely damaged Iran's defence capability and its ability to produce missiles'. 'The attack was precise and powerful and achieved its goals,' Netanyahu said at a ceremony commemorating the victims of last year's 7 October attacks. 'This regime must understand a simple principle: whoever hurts us, we hurt him.' Official Iranian sources have publicly played down the impact of the attack, saying most missiles were intercepted and those that weren't caused only limited damage to air defence systems. In his first public comments since the attack, Khamenei said: 'It is up to the authorities to determine how to convey the power and will of the Iranian people to the Israeli regime and to take actions that serve the interests of this nation and country.' President Pezeshkian largely echoed the supreme leader's language, telling a cabinet meeting: 'We do not seek war, but we will defend the rights of our nation and country.' The Israeli strikes were more limited than some observers had been expecting. The US had publicly pressured Israel not to hit oil and nuclear facilities, advice seemingly heeded by Tel Aviv. Western countries have urged Iran in turn not to respond in order to break the cycle of escalation between both Middle Eastern countries, which they fear could lead to all-out regional war. Iranian media has carried footage of daily life continuing as normal and framing the 'limited' damage as a victory, a choice analysts said was intended to reassure Iranians. Fighting continued between Israel and Iran-backed Hezbollah in Lebanon and between Israel and the Palestinian armed group Hamas in Gaza. On Sunday, an Israeli air strike on the town of Sidon in southern Lebanon killed at least eight people, according to local authorities. In Gaza, nine people were killed in an Israeli strike on a school-turned-shelter in the al-Shati refugee camp, Palestinians officials said. Palestinian media and the Reuters news agency said three of the dead were Palestinian journalists, citing government officials. And in Israel, a man was killed and at least 30 injured after a truck hit a bus stop near an Israeli military base north of Tel Aviv, in what authorities said was a suspected terror attack. Egyptian President Abdel Fattah al-Sisi on Sunday proposed a two-day ceasefire in Gaza, which would involve an exchange of four Israeli hostages for some Palestinian prisoners. He said that within 10 days of implementing such a temporary ceasefire, talks should resume with the aim of reaching a more permanent one. But speaking to the BBC's Arabic Service, a senior Hamas official said its conditions for a ceasefire – rejected by Israel for months – have not changed. Sami Abu Zuhri said the Palestinian militant group continued to demand a complete ceasefire, a full Israeli withdrawal from Gaza and a serious prisoner swap deal. 'Any agreement that does not guarantee these conditions holds no value,' he added.",
"Israel is under massive international pressure not to approve legislation Monday that would shut down the United Nations Relief and Works Agency operations servicing Palestinian refugees in east Jerusalem, Gaza, and the West Bank. Foreign Ministers from Canada, Australia, France, Germany, Japan, South Korea, and the United Kingdom issued a joint statement expressing their 'grave concern' over the shutdown, particularly in light of the dire humanitarian situation in Gaza due to the war. 'It is crucial that UNRWA and other UN organizations and agencies be fully able to deliver humanitarian aid and their assistance to those who need it most, fulfilling their mandates effectively,' they said. US Secretary of State Antony Blinken spoke with Israeli officials last week about the importance of ensuring that UNRWA, which has serviced Palestinian refugees in east Jerusalem, Gaza, and the West Bank since 1949, remains operational. The Biden administration mentioned the importance of maintaining UNRWA operations in a letter it wrote Israel in October, threatening to restrict military assistance to the IDF as dictated under Memorandum 20 unless Israel took steps to alleviate the humanitarian crisis in Gaza. US Ambassador to Israel Jack Lew is among a group of envoys, including from Germany, Italy, Australia, and Great Britain, who have also been holding conversations with Israeli politicians urging them to maintain UNRWA services. Israel fears that the international community could seek retribution by taking steps against it at the United Nations. Among the possible political action at the UN could be a push to strip the Jewish state of voting rights at the General Assembly, or the credentials of the Israeli mission to the UN could be stripped. UNRWA services 5.9 million refugees in Syria, Lebanon, Jordan, the West Bank, Gaza, and east Jerusalem. The UN General Assembly approves its mandate to operate annually, and only the UNGA has the power to close the organization. Israel, however, has the power to prevent UNRWA from operating in territory under its sovereign or military control. Prime Minister Benjamin Netanyahu and Right-wing politicians have long called for the UN to close UNRWA, but they have not seized control of the situation locally by using the government and legislative power they have to close the agency, which is seen as the primary organization providing humanitarian services to Palestinians. Israel had long argued that the organization incited against Israel and Jews and helped ensure that there would be a permanent and ever-expanding group of Palestinian refugees. The IDF, however, had held that UNRWA's provision of humanitarian services provided an important element of stabilization in the region. In the last year, since the Hamas-led invasion of Israel on October 7 and the IDF's subsequent military campaign against Hamas in Gaza, Israel, and the IDF have come to believe that UNRWA is so intertwined with Hamas that it can not be a neutral service provider. Worse, it had charged that a number of UNRWA employees were involved in the seizure of captives on October 7 and that the organization employed Hamas terrorists. Some six lawmakers had put forward legation to close UNRWA, which have now been reduced to two private member bills, which were approved by the Foreign Affairs and Defense Committee, whose chairman MK Yuli Edelstein (Likud) has explained that these bills are now considered committee legislation. The bill, which he said, has broad support from the opposition and the coalition, is now set for its final second and third readings. Edelstein told The Jerusalem Post that the first bill relates just to Jerusalem, and the second broad one cancels the invitation to UNRWA to operate in an area under Israeli control and bars Israeli officials from engaging with it. There is an irreparable difference of opinion between Israel and the international community, Edelstein said, adding that 'This is a gap we can't bridge.' The international community believes that UNRWA is 'irreplaceable' as a service provider and part of a 'solution' for Palestinians, he said. 'Our approach is that we have to legislate something that will effectively stop UNRWA activities in our area because they are part of the problem,' he said. Turning a blind eye Prior to October 7, everyone turned 'a blind eye' to the problem, he said. It's 'absurd' that a year has passed since the October 7 attack and the government has not yet taken any action against UNRWA. It's asking every other country to stop UNRWA's operations but has not taken any steps available to it to shut UNRWA down. 'There is no doubt,' he charged, 'that UNRWA is part of the Hamas rule in Gaza. It's part of raising another generation of terrorists in Gaza and Judea and Samaria and we have to put an end to it.' He noted that there is now wide consensus against UNRWA both in the opposition and the coalition, estimating that some 100 lawmakers are likely to support the two bills. He noted that once the bills pass, there would be a three-month period before UNRWA would have to cease its operations. This would allow time for another alternative to be found to provide services to Palestinians. A US Embassy spokesperson, however, hinted that Israel could be responsible for filling that gap. 'Pending legislation would make it impossible for UNRWA to operate and would leave a vacuum that Israel would then be responsible for filling. Adding to the humanitarian crisis that already exists would undermine stability and security for Israel and the region,' the spokesperson told The Jerusalem Post. The 'involvement of UNRWA personnel on Oct 7 was reprehensible, and led the US to halt funding,' the spokesperson said. 'We have called for those involved to be held accountable and for UNRWA reforms to address serious concerns about its facilities and personnel being involved in terrorist activities,' the spokesperson said. 'At the same time, UNRWA provides vital services in Gaza, the West Bank, Lebanon, and Jordan - including humanitarian assistance, health benefits care and sanitation,' the spokesperson explained. UNRWA called the pending Knesset vote ""outrageous. 'Such a move by a UN member state against a UN General Assembly-mandated organization is unprecedented and dangerous. It opposes the UN Charter and violates the State of Israel's obligations under international law,' a UNRWA spokesperson said. 'This is a step against the multilateral system. It is the latest step in the ongoing, systematic campaign to discredit UNRWA and delegitimize its role towards providing human-development assistance and services to Palestine Refugees,' the spokesperson stressed. Such a step would interrupt the provision of important humanitarian assistance to two million people in Gaza in the West Bank, 'with severe impact on the lives of people,' the spokesperson said 'Without UNRWA, the delivery of food, shelter, and health care to most of Gaza's population would grind to a halt,' the spokesperson stressed. Social services for Palestinians in the West Bank and east Jerusalem would collapse, the UNRWA spokesperson added. 'This legislation would set a grave precedent for other conflict situations where governments may wish to eliminate an inconvenient United Nations presence' and would compromise humanitarian work worldwide, the spokesperson said.",
