Summary,Score
"Tensions continue to build in the Middle East after the Israeli military traded more fire with Iranian-backed Hezbollah militants in Lebanon. At least 18 people are dead after an Israeli airstrike on an apartment building in northern Lebanon. The attack came after a Hezbollah drone attack on an Israeli army base left four soldiers dead and dozens of others severely wounded. RELATED STORY | Drone strike in Israel wounds almost 40 as Hezbollah claims responsibility ""Overnight, Iranian proxy Hezbollah conducted a UAV attack against Israel – a brutal attack that killed four troops and injured many more,"" Israeli Defense Minister Yoav Gallant said in a statement. ""It only further points to the ongoing threats posed by Hezbollah, and the urgency to take every necessary measure to dismantle their attack infrastructure."" On Monday, Israeli Prime Minister Benjamin Netanyahu toured the army base targeted in the attack, vowing Israel ""will continue to hit Hezbollah everywhere, even in Beirut."" RELATED STORY | US will send an air defense battery and American troops to Israel to bolster defenses against Iran Meanwhile, U.S. Defense Secretary Lloyd Austin has authorized the deployment of a sophisticated air defense system to Israel, as well as American troops to operate it, even as Iran has warned the U.S. to keep troops out of Israel. And while the new defense system won't be there to deal with Hezbollah drone and rocket attacks, it will be used to address longer range threats from Iran.",
"Iran's oil exports dropped by around 42 percent in early October amid fears surrounding Israeli strike threats likely targeting Iranian oil sites, according to Oil&Gas. Tanker tracking firm data indicated that Iranian oil exports fell to 600,000 barrels of oil loaded per day in the first 10 days of the month, rather than the average 1.4 million barrels per day seen in recent months. Israeli Prime Minister Benjamin Netanyahu has vowed Iran will ""pay for"" its strike on Israel on October 1, when Iran fired approximately 180 missiles, according to Reuters. Israel is rumored to be considering attacking Iran's oil sites. An oil terminal in Tehran photographed on November 13, 1979. Iranian oil sites are reportedly in danger of being the target of an upcoming Israeli strike in retaliation for Iranian strikes against Israel. An oil terminal in Tehran photographed on November 13, 1979. Iranian oil sites are reportedly in danger of being the target of an upcoming Israeli strike in retaliation for Iranian strikes against Israel. Mohammad Sayad/Associated Press Newsweek reached out to the Iran Ministry of Petroleum for comment via email. Satellite imagery recently showed oil tankers vacating the waters surrounding Kharg Island, Iran's main oil terminal, which some fear may be Israel's target, according to CNBC. Iranian oil exports are expected to remain lower throughout this month and reach a maximum of 1.35 million barrels per day, according to OilPrice.com. Adding to Iran's struggles with oil exports, the U.S. recently imposed further sanctions on Iran's ""ghost fleet"" of ships and companies in the United Arab Emirates, Liberia, Hong Kong, and other locations that transport and aid oil exports to buyers in Asia on October 11. These sanctions follow Iran's strike on Israel on October 1, and U.S. national security adviser Jake Sullivan said the sanctions will ""help further deny Iran financial resources used to support its missile programs and provide support for terrorist groups that threaten the United States, its allies and partners."" Anoush Ehteshami, a political scientist and professor of International Relations in the School of Government and International Affairs at Durham University, spoke to Newsweek about how Iran's decrease in oil exports could affect the U.S. politically and economically. Ehteshami said, ""In terms of the U.S.' own energy policy, if anything it enhances Biden's hand. The U.S. is now the world's premium producer, and as it happens, also exporting to lots of places, including Europe of oil products and oil itself and of course, energy as well. So, the less comes out of the Persian Gulf, the more reliant the major economies are going to be on the U.S. In one sense, Iran's isolation in the absence of increased production by the Saudis, the Iraqis, and the Marathis, will mean a growing demand for U.S. production of exports."" He went on to explain that in previous historical instances where Iran has faced oil export crises of this nature, Saudi Arabia has ""loosened the taps"" and ""allow more oil to come onto the market in order to stabilize prices,"" but emphasized that they may not do so in this instance as Iran may see the action as ""pro-American"" and therefore against their own diplomatic ties with the country. Ehteshami did note that Russia, like the U.S., could benefit from Iran's decrease in oil exports, and that he believes Japan, South Korea, China, and India will the consumers who are ""going to be most concerned about any tightening of the international oil markets, because they are the ones who are directly dependent on market fluctuations internationally."" He continued, ""Nevertheless, it's not about Iran itself, to tightening of Iranian export capability that matters. Because oil prices are volatile, and they always tend to have a worst-case scenario outlook down the line, a week, a month, three months, and so on. It's the perception of how American Iranian tensions, Iranian Israeli tensions are interpreted in oil markets that really matters."" Ehteshami also spoke at length about the effects of the U.S.' new sanctions on Iran's oil exports and moreover, the Iranian economy at large, highlighting that it will affect the economic situation ""very gravely."" He said, ""Iran's economy is already on its knees because of sanctions, because of incompetent management, because of cronyism and corruption, and also because, frankly, of lack of investment by much of the world in development and modernization of infrastructure. Oil has been one of the lifelines, and China in particular has been very happy to continue to buy discounted Iranian oil, but this has declined. Ehteshami attributed China's declining demand for oil from Iran to Russia's oil exports, and emphasized that if Iran's oil competitors manage to increase output and meet global market demands, Iran will suffer and it will have heavy effects on the currency, inflation, imports, and ""the country's ability to continue to maintain a general macroeconomic position at home."" This decrease in oil exports follows Iran's previous economic high earlier this year, as Iranian exports hit 1.82 million barrels per day in March, the highest rate in six years, and overall exports of 141.7 million barrels in the first quarter of this year according to Foundation for Defense of Democracies. Do you have a story we should be covering? Do you have any questions about this article? Contact LiveNews@newsweek.com.",
"DEIR AL-BALAH, Gaza Strip (AP) -- An Israeli airstrike on a hospital courtyard in the Gaza Strip early Monday killed at least four people and sent flames sweeping through a packed tent camp for people displaced by the war, leaving more than two dozen with severe burns, according to Palestinian medics. The Israeli military said it targeted militants hiding out among civilians, without providing evidence. In recent months it has repeatedly struck crowded shelters and tent camps, alleging that Hamas fighters were using them as staging grounds for attacks. The Al-Aqsa Martyrs Hospital in the central city of Deir al-Balah was already struggling to treat a large number of wounded people from an earlier strike on a school-turned-shelter nearby that killed at least 20 people when the early morning airstrike hit and fire engulfed many of the tents. Associated Press footage showed children among the wounded. A man sobbed as he carried a toddler with a bandaged head in his arms. Another small child with a bandaged leg was given a blood transfusion on the floor of the packed hospital. Hospital records showed that four people were killed and 40 wounded. Twenty-five people were transferred to the Nasser Hospital in southern Gaza after suffering severe burns, according to the Al-Aqsa Martyrs Hospital. Israel is still carrying out near-daily strikes across the Gaza Strip more than a year into the war, and has been waging a major ground assault in the north, where it says militants have regrouped. The war began when Hamas attacked southern Israel on Oct. 7, 2023, killing some 1,200 people, mostly civilians, while Palestinian militants abducted around 250 hostages. Around 100 are still being held inside Gaza, a third of whom are believed to be dead. Israel's retaliatory offensive has killed over 42,000 Palestinians, according to Gaza's Health Ministry, which does not say how many were fighters but says women and children make up more than half the fatalities. Around 90 percent of Gaza's population of 2.3 million people have been displaced by the war, often multiple times, and large areas of the coastal territory have been completely destroyed. Israel has ordered the entire remaining population of the northern third of Gaza, estimated at around 400,000 people, to evacuate to the south and has not allowed any food to enter the north since the start of the month. Hundreds of thousands of people from the north heeded Israeli evacuation orders at the start of the war and have not been allowed to return. That has raised fears among Palestinians that Israel intends to implement a plan devised by former generals in which it would order all civilians out of northern Gaza and label anyone remaining there a combatant — a surrender-or-starve strategy that rights groups say would violate international law. The plan has been presented to the Israeli government, but it's unclear whether it has been adopted. With no end in sight to the war in Gaza, Israel is also waging an air and ground war in southern Lebanon against the Hezbollah militant group, an ally of Hamas that has been firing rockets into northern Israel for more than a year. Israel has also threatened to strike Iran in retaliation for a ballistic missile attack, raising the prospect of an all-out regionwide war.",
"BEIRUT, Oct. 14 (Xinhua) -- The Lebanese Mission to the United Nations on Monday filed two complaints to the UN Security Council against Israel regarding the repeated attacks on the positions of the United Nations Interim Force in Lebanon (UNIFIL) and the impact of Israeli military actions on the Lebanese education sector. The first complaint, according to the Lebanese National News Agency, considered Israel's request for the peacekeeping forces to evacuate their positions as ""illegitimate."" Lebanon stressed that ""the Israeli attacks on UNIFIL are a dangerous precedent and a flagrant violation of international law and Security Council Resolution 1701."" In the complaint, Lebanon demanded ""a firm and strict stance"" be taken against these attacks, stressing ""the need to hold Israel accountable for these violations and prevent it from repeating them, to avoid casualties among UNIFIL forces, and to ensure UNIFIL's ability to continue fulfilling its obligations stipulated in its mandate."" Five UNIFIL personnel were injured in recent days during battles between the Israeli army and Hezbollah in southern Lebanon, where UNIFIL accused the Israeli army of ""repeatedly"" firing at its positions. The Lebanese Mission to the United Nations also submitted a second complaint regarding the Israeli attacks' impact on the education sector in Lebanon. In the complaint, Lebanon urged UN Security Council to intervene urgently and effectively to stop the ongoing Israeli ""aggression"" on its territory, which it said had deprived nearly 1.4 million students of their basic right to education. The complaint called on the international community to ""move immediately to ensure the cessation of aggression and the protection of the right to education as a fundamental pillar for building a stable and secure future for the country."" The Israeli army has launched intensive attacks on Lebanon since late September in an escalation with Hezbollah, heightening concerns about a broader war as the conflict between Hamas and Israel continues in the Gaza Strip. According to the Lebanese Health Ministry, the death toll from the Israeli attacks on Lebanon since the onset of the Hezbollah-Israeli conflict has reached 2,309, with injuries totaling 10,782. Enditem",
"I srael stands like a steady rock in the midst of choppy seas. Post its retaliation of the 7 October 2023 attacks, it has almost completely destroyed Gaza and 'claims' to have annihilated Hamas as also its ability to wage war. It was also behind the assassination of Ismail Haniyeh, the political leader of Hamas in Tehran in July this year. However, recent rocket attacks from Gaza display that Hamas still possesses the capability to strike, though not at the same level as before. This has led to Israel reengaging Hamas militarily. A number of Israeli hostages remain with Hamas. Talks of peace and return of hostages are no longer on the cards. The Hezbollah in Lebanon supported Hamas by targeting Israel with over 8,000 rockets during the past year. Hezbollah is believed to possess around 150,000 rockets. Israel was compelled to relocate almost 100,000 settlers from its northern region bordering Lebanon. Once it contained Hamas, Israel commenced targeted operations against the Hezbollah as per a systematic plan. It initially exploded pagers killing or maiming the group's middle level leaders as also impacting their communications. Next it hit its top hierarchy, including its secretary general, Hassan Nasrallah, as also most of its Radwan (special forces) Unit leadership, adding to turmoil within the Hezbollah. Simultaneously, the Israeli Air Force launched concerted aerial assaults targeting Hezbollah's stockpiles of rockets and their launchers. It has been a couple of weeks and Hezbollah is yet to announce Nasrallah's replacement, conveying hesitation amongst its hierarchy to take up the responsibility.",
"Palestinian officials reported at least 28 dead, including four children, in an Israeli strike on a school being used as a shelter in Gaza on Thursday. Nearly 100 people were wounded in the strike in Jabaliya, according to the Gaza Health Ministry's emergency unit in the north. The Israeli military said it is "" I hope they would return home because it has become too dangerous there, """,
"On October 16, Israel's air defense systems activated in the north, followed by a blast and sirens. That same day, an Israeli airstrike destroyed municipal",
"The IDF is investigating the possibility that one of the three militants it killed in a recent Gaza battle was Hamas leader Yahya Sinwar. "" At this time, the identity of the terrorists cannot be confirmed, "" the Israeli military said in a",
"Yahya Sinwar, the leader of Hamas, was killed during an Israeli military operation, Israeli Foreign Minister Israel Katz confirmed late on Thursday. The October 7 mastermind was the architect behind the October 7 terror attacks last year on Israel, which left some 1,200 people dead and led to hundreds being taken hostage. Those terror attacks prompted Israel's current . The 61-year-old became the political leader of Hamas in after the August in Iran's capital, Tehran. Hamas, which rules over the Palestinian territory of Gaza, is deemed a terrorist organization not only by Israel, but also the US, Germany and several other countries. The Hamas leader was born in a Palestinian refugee camp in the southern Gaza city of Khan Younis. He joined Hamas in 1987 shortly after it was founded. Sinwar spent decades in Israeli prisons for killing two Israeli soldiers. During the imprisonment, he read Israeli newspapers and reportedly became fluent in Hebrew. Israeli doctors also saved his life from a cancerous brain tumor and provided him with dental treatment. The 'Butcher of Khan Younis' Sinwar was released in 2011 as part of a prisoner exchange for captured Israeli soldier Gilad Shalit. Palestinian militants had abducted Shalit in 2006. Sinwar's ruthlessness and zero tolerance for Palestinian collaborators with Israel led him to being called the 'Butcher of Khan Younis.' Following the October 7 terror attacks, there were reports that he spoke in Hebrew with a group of Israeli hostages held by Hamas in Gaza. wd/ab (Reuters, AP) The post",
"DUBLIN, (PIC) Ireland plans to independently impose economic sanctions on the Israeli occupation state, announcing that it will not wait for the EU to unilaterally suspend trade with Israel, after pro-Israel countries foiled the attempt of Ireland and Spain to act towards this end within the framework of the",
